{
  "$schema": "https://json-schema.org/draft/2020-12/schema",
  "title": "Digital Self Story Triple",
  "description": "A story, accomplishment, or lesson from a person's life. The universal building block of digital identity.",
  "type": "object",
  "required": ["triple", "category", "featured"],
  "properties": {
    "triple": {
      "type": "object",
      "required": ["what", "proud", "era"],
      "properties": {
        "what": {
          "type": "string",
          "description": "What happened or was achieved"
        },
        "proud": {
          "type": "string",
          "description": "Why this matters -- the significance, the pride"
        },
        "era": {
          "type": "string",
          "description": "Named era of life (e.g. early, high-school, javelin, enterprise, metal)"
        }
      }
    },
    "category": {
      "type": "string",
      "enum": ["sport", "creation", "lesson", "recognition", "story", "growth"],
      "description": "What kind of entry this is"
    },
    "date": {
      "type": ["string", "null"],
      "description": "When it happened. YYYY, ~YYYY (approximate), YYYY-MM-DD, or null if unknown"
    },
    "people": {
      "type": "array",
      "items": { "type": "string" },
      "description": "People involved or referenced"
    },
    "domain": {
      "type": "string",
      "enum": ["code", "leadership", "life", "business", "hardware", "athletics", "people"],
      "description": "Primary domain"
    },
    "tags": {
      "type": "array",
      "items": { "type": "string" },
      "description": "Free-form tags for filtering and discovery"
    },
    "featured": {
      "type": "boolean",
      "description": "true = shows on curated identity page, false = timeline only"
    }
  }
}