{
  "triple": {
    "what": "Built enterprise POS platform used in hospitality for 20+ years -- land, sea, and air",
    "proud": "Over a billion hours of combined uptime. The system outlived the company.",
    "era": "enterprise"
  },
  "category": "creation",
  "date": "~2004",
  "people": [],
  "domain": "code",
  "tags": ["shipping", "architecture", "hospitality", "enterprise", "uptime"],
  "featured": true
}