{
  "triple": {
    "what": "The best code is no code. It never breaks and always works.",
    "proud": "Simplicity as the ultimate sophistication -- 40 years to learn this",
    "era": "enterprise"
  },
  "category": "lesson",
  "date": null,
  "people": [],
  "domain": "code",
  "tags": ["wisdom", "simplicity", "architecture", "minimalism"],
  "featured": false
}