{
  "triple": {
    "what": "Vision: replace x86 -- build the chip, build the stack, goodbye operating system, hello runtime",
    "proud": "Why? Because I can. The binary decision made by hardware engineers in another era is ready to be rethought.",
    "era": "metal"
  },
  "category": "growth",
  "date": "~2025",
  "people": [],
  "domain": "hardware",
  "tags": ["vision", "hardware", "runtime", "chip", "future"],
  "featured": true
}