{
  "triple": {
    "what": "Norman Campbell told me you can't argue with right",
    "proud": "Changed how I fight -- with facts, not volume",
    "era": "javelin"
  },
  "category": "lesson",
  "date": null,
  "people": ["Norman Campbell"],
  "domain": "people",
  "tags": ["wisdom", "mentorship", "verbal-judo"],
  "featured": true
}