{
  "triple": {
    "what": "Built NorthStar Online Ordering -- omnichannel ordering across multiple customer touchpoints",
    "proud": "Customers order from anywhere. The system handles it all.",
    "era": "enterprise"
  },
  "category": "creation",
  "date": null,
  "people": [],
  "domain": "code",
  "tags": ["online-ordering", "omnichannel", "hospitality", "cbs-northstar"],
  "featured": true
}