{
  "triple": {
    "what": "Building a platform for mankind -- ai-pantheon.ai, metal, nous -- north star is Build Your Digital Self",
    "proud": "Every person deserves a digital identity they own. Not a profile on someone else's platform.",
    "era": "metal"
  },
  "category": "creation",
  "date": "~2025",
  "people": [],
  "domain": "business",
  "tags": ["vision", "platform", "identity", "digital-self", "ai-pantheon"],
  "featured": true
}