{
  "triple": {
    "what": "Sometimes it's best to look at things from the solution backward to the request. Identify better versions of the request and shake out the waste.",
    "proud": "Find the pure intention behind every ask -- that's where the real solution lives",
    "era": "enterprise"
  },
  "category": "lesson",
  "date": null,
  "people": [],
  "domain": "leadership",
  "tags": ["wisdom", "problem-solving", "intent", "clarity"],
  "featured": false
}