{
  "triple": {
    "what": "Built the NorthStar Point of Sale -- cloud-based POS platform powering 10,000+ restaurant operators",
    "proud": "The core product. Omnichannel, scalable, ran across restaurants, fast casual, QSR, grocery, and convenience stores.",
    "era": "enterprise"
  },
  "category": "creation",
  "date": null,
  "people": [],
  "domain": "code",
  "tags": ["pos", "cloud", "hospitality", "cbs-northstar", "enterprise"],
  "featured": true
}