{
  "triple": {
    "what": "Built NorthStar Labor Management -- integrated workforce optimization and scheduling",
    "proud": "Labor is the biggest cost in hospitality. This system optimizes it across the entire operation.",
    "era": "enterprise"
  },
  "category": "creation",
  "date": null,
  "people": [],
  "domain": "code",
  "tags": ["labor", "scheduling", "workforce", "hospitality", "cbs-northstar"],
  "featured": true
}