{
  "triple": {
    "what": "When your brain can no longer find the solution, identify everything you don't know and forget what you do know. Your mind has no choice but to think different.",
    "proud": "Discovered the mental reset that unlocks impossible problems",
    "era": "enterprise"
  },
  "category": "lesson",
  "date": null,
  "people": [],
  "domain": "life",
  "tags": ["wisdom", "problem-solving", "creativity", "unblocked"],
  "featured": true
}