{
  "triple": {
    "what": "Built metal -- bare metal provisioning system. One command, cross-platform, no prerequisites beyond curl.",
    "proud": "The provisioner eats its own cooking. Idempotent. Safe to re-run. The structure never drifts.",
    "era": "metal"
  },
  "category": "creation",
  "date": "~2025",
  "people": [],
  "domain": "code",
  "tags": ["shipping", "bare-metal", "provisioning", "metal", "cross-platform"],
  "featured": true
}