{
  "triple": {
    "what": "Learned that 'for now' equals technical debt -- it grows interest and costs 10x more to remove",
    "proud": "Do it right the first time, always. This principle has saved millions.",
    "era": "enterprise"
  },
  "category": "lesson",
  "date": null,
  "people": [],
  "domain": "code",
  "tags": ["wisdom", "technical-debt", "discipline", "quality"],
  "featured": true
}