{
  "triple": {
    "what": "Built NorthStar Payment Processing -- flexible payment processor integration",
    "proud": "Your choice of processor, not ours. Built the abstraction layer that makes it work with any provider.",
    "era": "enterprise"
  },
  "category": "creation",
  "date": null,
  "people": [],
  "domain": "code",
  "tags": ["payments", "processing", "hospitality", "cbs-northstar"],
  "featured": true
}