{
  "triple": {
    "what": "Built NorthStar Loyalty and Gift Cards -- customer retention programs and gift card management",
    "proud": "Loyalty drives repeat business. Built the system that keeps customers coming back.",
    "era": "enterprise"
  },
  "category": "creation",
  "date": null,
  "people": [],
  "domain": "code",
  "tags": ["loyalty", "gift-cards", "hospitality", "cbs-northstar"],
  "featured": true
}