{
  "triple": {
    "what": "Built NorthStar Kitchen Display Systems -- integrated displays, bump bars, kitchen coordination",
    "proud": "Every ticket flows from POS to kitchen to plate. The back of house runs on this.",
    "era": "enterprise"
  },
  "category": "creation",
  "date": null,
  "people": [],
  "domain": "code",
  "tags": ["kds", "kitchen", "hospitality", "cbs-northstar"],
  "featured": true
}