{
  "triple": {
    "what": "Created the Water of Life formula and gave it away free at wateroflife.supply",
    "proud": "Some things are too important to sell. Give away the formula, keep the mission.",
    "era": "metal"
  },
  "category": "creation",
  "date": "~2025",
  "people": [],
  "domain": "life",
  "tags": ["water", "formula", "giving", "mission"],
  "featured": true
}