{
  "triple": {
    "what": "Built NorthStar Recipe Management -- protects and manages proprietary food preparation procedures",
    "proud": "Recipes are trade secrets. This system guards them while making them operationally accessible.",
    "era": "enterprise"
  },
  "category": "creation",
  "date": null,
  "people": [],
  "domain": "code",
  "tags": ["recipe", "management", "hospitality", "cbs-northstar"],
  "featured": true
}