{
  "triple": {
    "what": "Built NorthStar Digital Signage -- real-time, instant-updating customer communication displays",
    "proud": "Menu boards, promotions, wait times -- all updated in real time from the same system that runs the restaurant.",
    "era": "enterprise"
  },
  "category": "creation",
  "date": null,
  "people": [],
  "domain": "code",
  "tags": ["signage", "displays", "hospitality", "cbs-northstar"],
  "featured": true
}