{
  "triple": {
    "what": "Fixed a critical production defect near blackout drunk on tequila -- Notepad was my IDE, it compiled, shipped, and worked",
    "proud": "The brain and mind are far more powerful than you think",
    "era": "enterprise"
  },
  "category": "story",
  "date": "~2015",
  "people": [],
  "domain": "code",
  "tags": ["shipping", "resilience", "bare-metal", "legendary"],
  "featured": true
}