{
  "triple": {
    "what": "CTO at CBS Northstar (cbsnorthstar.com) -- built nearly every software product they sell. 9 products, 10,000+ operators, restaurants to convenience stores.",
    "proud": "Land, sea, and air. The entire product suite came from my hands. 30 years of hospitality tech, and my code is still the foundation.",
    "era": "enterprise"
  },
  "category": "recognition",
  "date": null,
  "people": [],
  "domain": "business",
  "tags": ["cto", "leadership", "cbs-northstar", "hospitality", "enterprise"],
  "featured": true
}