{
  "triple": {
    "what": "Ken Kadlec taught me that everyone knows something you don't, and you know something everyone else doesn't",
    "proud": "Learned to listen before solving -- humility as a superpower",
    "era": "javelin"
  },
  "category": "lesson",
  "date": null,
  "people": ["Ken Kadlec"],
  "domain": "people",
  "tags": ["wisdom", "mentorship", "humility"],
  "featured": true
}