{
  "triple": {
    "what": "CTO-level delivery at companies you've heard of -- reporting suites, POS platforms, enterprise systems",
    "proud": "Shipped at scale across restaurants, cruise ships, airports",
    "era": "enterprise"
  },
  "category": "recognition",
  "date": "~2000",
  "people": [],
  "domain": "business",
  "tags": ["leadership", "enterprise", "hospitality", "shipping"],
  "featured": true
}